{"approvals":[{"approved_at":"2026-06-01T12:58:00Z","assignment_ref":{"artifact_path":"contracts/fixtures/governance-models/valid/owner-assignment-v2-planning.json","artifact_sha256":"089fd1c73350b99c8a67f96ab2a1241a713ca6decbdf142280e65370a3d2966d","authority_id":"fixture-v2-planning-owner-assignment","revision":1,"verified_at":"2026-06-01T13:00:00Z"},"decision":"APPROVED","principal_id":"fixture-contract-owner-person","role_id":"contract-owner"},{"approved_at":"2026-06-01T12:58:00Z","assignment_ref":{"artifact_path":"contracts/fixtures/governance-models/valid/owner-assignment-v2-planning.json","artifact_sha256":"089fd1c73350b99c8a67f96ab2a1241a713ca6decbdf142280e65370a3d2966d","authority_id":"fixture-v2-planning-owner-assignment","revision":1,"verified_at":"2026-06-01T13:00:00Z"},"decision":"APPROVED","principal_id":"fixture-security-owner-person","role_id":"security-owner"}],"artifact_metadata":{"classification":"SYNTHETIC_FIXTURE","evidence_claim":"NOT_EVIDENCE_OR_PASS","fixture_notice":"SYNTHETIC EXAMPLE ONLY; NOT EVIDENCE; NOT A PASS VERDICT"},"canonicalization":"RFC8785-JSON-UTF8","digest_algorithm":"SHA-256","distribution_role_slots":["release-owner","security-owner"],"distribution_signature_domain_template":"ylx.release-distribution-control.v2/<role_slot>","distribution_signed_artifact_schema":"ylx.release-distribution-control.v2","distribution_signed_payload_rule":"OMIT_SIGNATURES_BY_ROLE_SLOT_THEN_RFC8785_JSON_UTF8","minimum_key_validity_horizon_seconds":86400,"normal_post_signature_expiry_rule":"DOES_NOT_INVALIDATE_VALID_SIGNATURE","policy_id":"fixture-m5-signing-policy-v2","predecessor_policy_ref":null,"public_key_encoding":"32-byte-raw-Ed25519","published_at":"2026-06-01T12:59:00Z","retroactive_revocation_rule":"INVALID_ONLY_WHEN_EFFECTIVE_AT_OR_BEFORE_SIGNED_AT","revision":1,"schema":"ylx.m5-signing-policy.v2","signature_algorithm":"Ed25519","signature_domain_template":"ylx.release-closure.quorum.v2/<role_slot>","signature_encoding":"base64","signature_message_rule":"ASCII_DOMAIN || 0x00 || RFC8785_SIGNED_PAYLOAD_JSON_BYTES","signed_artifact_schema":"ylx.pre-release-closure.v2","signed_payload_schema":"ylx.release-quorum-signature.signed-payload.v2","valid_at_signature_rule":"SIGNED_AT_WITHIN_NOT_BEFORE_AND_NOT_AFTER"}